_id,content,category
121767,آیا درباره کار‌هایی مانند خرید و فروش و اجاره می‌توان شخص کافری را به وکالت انتخاب کرد؟,احکام و فقه
121768,آیا شخص سفیه یا مُفلِس (ورشکست) می‌تواند در امور مالی خود وکیل بگیرد؟,احکام و فقه
121769,وکالت به چه معناست؟,احکام و فقه
121770,آیا کودک می‌تواند وکیل بگیرد و یا وکیل باشد؟,احکام و فقه
122487,اگر مادری به دلیل ناخوشی و بی حالی ناشی از بیماری کرونا قادر به شیردهی به کودک خود نیست، چه باید کرد؟ چطور می توان احتمال انتقال ویروس کرونا به شیرخوار را کاهش داد؟,احکام و فقه
122492,مبنای نظری ممنوعیت مواد مخدر در آموزه های اسلامی چیست و دلایل تحریم و مخالفت های شدید با مواد مخدر در اسلام را بیان کنید.,احکام و فقه
122690,اگر با باز گذاشتن درب مسجد، احتمال تلف شدن اموال مسجد داده شود آیا متولی می‌تواند از ورود اشخاص به مسجد جلوگیری کند؟,احکام و فقه
122691,بستن درب مساجد در قسمتی از وقت ادای نماز با یقین به وجود نمازگزاران در آن وقت یا احتمال آن، چه حکمی دارد؟,احکام و فقه
122692,نماز خواندن در مساجد اهل تسنن و با جماعت آن‌ها چه حکمی دارد؟,احکام و فقه
122693,آیا اهل کتاب و مشرکان می‌توانند وارد مسجد شود؟,احکام و فقه
122694,آیا عزاداران اباعبدالله الحسین علیه‌السلام با کفش می‌توانند، وارد مسجد شوند؟ آیا تعزیه‌خوانی در مسجد که با پوشیدن چکمه و دیگر ادوات جنگی همراه می‌باشد، جایز است؟,احکام و فقه
122695,کشیدن سیگار در مسجد با این‌که بیماری‌هایی را به همراه دارد و باعث ناراحتی و آزار مؤمنین نمازگزار می‌شود و هوای مسجد را آلوده می‌کند چه حکمی دارد؟,احکام و فقه
122696,آیا شخصی که موقع اقامۀ جماعت در مسجد خوابیده را می‌شود بیدار کرد؟,احکام و فقه
122697,"الف) برخی نمازگزاران اموال شخصی خود را مثل سجاده و صندلی و... داخل مسجد می‌گذارند. آیا متولی مسجد می‌تواند بنابرمصالحی - اگرچه صرفاً مصلحت نظم باشد- این اقدام را ممنوع کند؟ 
ب) آیا می‌تواند در صورتی که به نهی او ترتیب اثر ندهند با هشدار قبلی اموال را جمع آوری کرده و بیرون مسجد بگذارد؟",احکام و فقه
122698,آیا ممانعت از بعضی کارها مثل خوابیدن، غذا خوردن، مطالعه کردن در مسجد مشروع است؟,احکام و فقه
122699,خوابیدن در مسجد چه حکمی دارد؟,احکام و فقه
122701,هیأتی در یکی از مساجد تأسیس شده و کلیۀ امور مسجد را بر عهده گرفته؛ آیا نصب تابلویی به نام هیأت، جهت مشخص نمودن مکان هیأت در دیوار یا جلوی مسجد جایز است؟,احکام و فقه
122702,امام جماعتی که متولی مسجد است، می‌تواند وصیت کند پس از او شخص خاصی امامت جماعت مسجد را عهده دار باشد؟,احکام و فقه
122703,گاهی برای مخارج مسجد از نمازگزاران پول جمع می‌شود، برخی آن پول‌ها را که پول خرد هستند با پول درشت تعویض می‌نمایند، این امر صحیح است یا خیر؟,احکام و فقه
122705,وظایف ضامن در قبال پرداخت بدهی چیست؟,احکام و فقه
122706,آیا می‌توان مثلاً وجوهات مربوط به ساخت مساجد را به‌عنوان قرض در راه خیری صرف کرد و بعد جایگزین نمود؟,احکام و فقه
122707,آیا افرادی که چند سال مبالغی را به‌عنوان کمک یا نذری به حسینیه داده‌اند، می‌توانند وجه خود را پس بگیرند؟,احکام و فقه
122708,گاهی مردم وسایلی همانند سماور و یا روسری برای مسجد نذر می‌کنند که مسجد نیازی به آن‌ها ندارد، آیا می‌توان آن‌ها را فروخت و صرف مسجد کرد؟,احکام و فقه
122709,حکم پخش اذان و مناجات با بلندگوی مسجد، درصورتی‌که همسایگان اعلام نارضایتی می‌کنند چیست؟,احکام و فقه
122710,زمانی که مردم در حال استراحت هستند، پخش اذان با بلندگو چه حکمی دارد؟,احکام و فقه
122711,آیا آذین بستن داخل مسجد و استفاده از لامپ‌ها و کاغذهای رنگی برای اعیاد و موالید ائمه علیهم‌ السلام جایز است؟,احکام و فقه
122712,بلندی صدای بلندگوی مسجد تا چه اندازه جایز است؟,احکام و فقه
122713,آیا قرار دادن تابلوهای اعلانات در مساجد جایز است؟,احکام و فقه
122714,نصب تصاویر شهدا و عکس‌ های منسوب به ائمۀ اطهار علیهم‌ا لسلام در مساجد چگونه است؟ و آیا اثری در قبولی و ثواب نماز دارد؟,احکام و فقه
122716,آیا اجرای شبیه‌خوانی و عزاداری حضرت اباعبدالله الحسین علیه‌السلام در مسجد ‌که مانع از برگزاری نماز جماعت یا نماز فرادای عده‌ای از مردم شود، جایز است؟,احکام و فقه
122719,چند سال پیش با دست نجس به آبدارخانۀ مسجد وارد شده و با همان دست که مقدار کمی تر بود به نیمکت چوبی آبدارخانه دست زدم و آن‌جا را تمیز نکردم؛ در چنین شرایطی تکلیف بنده چیست؟,احکام و فقه
122720,در روستایی به خاطر ندانستن مسأله، توالت را در خود زمین مسجد ساخته‌اند وچاه تخلیۀ آن هم در زمین خود مسجد است تکلیف چیست؟,احکام و فقه
122721,آیا نمایش فیلم سینمایی و برگزاری تئاتر در مساجد جایز است؟,احکام و فقه
122722,آیا لوازم مسجد همچون منبر مسجد در حرمت نجس نمودن و لزوم تطهیر فوری، مانند مسجد است؟,احکام و فقه
122723,اخیرا پدیده‌ای به نام مساجد سیار پیدا شده که ماشین‌های متحرکی برای اقامۀ نماز هستند، آیا می‌شود آنجا را وقف مسجد کرد و آیا در این صورت احکام مسجد را دارد؟,احکام و فقه
122724,آیا می‌شود با کفش یا پای نجس به قسمتی از حیاط مسجد که آسفالت است وارد شد؟,احکام و فقه
122725,ساختن گنبد و گل‌دسته برای مساجد و حسینیه‌ها -که امروزه به‌عنوان نمادهای مذهبی برای این مکان‌ها شمرده می‌شود- در شرع مقدّس چه حکمی دارد؟,احکام و فقه
122726,ساخت مسجد با هزینه‌های گزاف چه حکمی دارد؟,احکام و فقه
122727,یکی از مکان‌هایی که در آن نماز خواندن مکروه است جایی است که انسانی روبروی نمازگزار باشد. حال برای رفع کراهت در حرم‌ها و مساجدی که در آن‌جا رفت آمد زیاد است چه باید کرد؟,احکام و فقه
122728,آیا می‌شود بعد از غسل در همان حمام نماز خود را بخوانیم؟,احکام و فقه
122729,آیا خواندن نماز در آشپزخانه جایز است؟,احکام و فقه
122730,نماز خواندن در مقابل وسایل آتشی مانند بخاری چه حکمی دارد؟,احکام و فقه
122731,آیا نماز در خانه‌ای که عکس یا مجسمۀ انسان و حیوان دارد ولی پشت سر نمازگزار قرار گرفته است هم کراهت دارد؟,احکام و فقه
122732,آیا نماز خواندن در مقابل آینه کراهت دارد؟,احکام و فقه
122733,آیا نماز در مقابل عکس مسجدالحرام و حرم ائمه علیهم‌ السلام صحیح است؟,احکام و فقه
122734,اگر در خانه حیوانات خشک شده‌ای باشد می‌توان رو به روی آن‌ها نماز خواند؟,احکام و فقه
122735,آیا نماز خواندن بر روی فرشی که تصویر گیاهان و یا جان‌داران بر آن نقش بسته، اشکال دارد؟,احکام و فقه
120712,برهنه شدن و سینه زدن شدید در مراسم عزای امام حسین(علیه السلام) چه حکمی دارد؟,احکام و فقه
120723,آیا این مطلب صحیح است که در روز عاشورا انسان نباید برای خودش دعا کند؟,احکام و فقه
122362,مهریه ی خانمی دورکعت نماز هدیه به امام زمان(عج) به صورت روزانه و مادام العمر می باشد که همسرش باید ادا کند، آیا واجب بودن این نماز، به خاطر اینکه مهریه عند المطالبه هست می باشد و اینکه مانند نمازهای یومیه واجب می شود؟,احکام و فقه
122363,آیا می توان هدیه دادن قرآن به مسجد یا بخشیدن 5 میلیون تومان برای برگزاری روضه ی ائمه ی معصومین عیهم السلام هر سال سه روز یا زیارت جمکران سالی یکبار و امثال آن، را بعنوان مهریه قرار داد؟,احکام و فقه
122366,اگر مردی بمیرد و همسرش بعد از نماز میت مهر خود را حلال کند، اما بعد از چند ماه مطالبه نماید، حکم آن چیست؟,احکام و فقه
122367,آیا این مطلب از نظر معظم له صحیح است : اگر زن قبل از دخول مهریه ی خود را ببخشد و مرد بعد از آن در حالی که هنوز زن باکره است او را طلاق بدهد، زن نیمی از مهریه را بدهکار است.,احکام و فقه
122368,اگر خانمی چندین مرتبه مهریه ی خود را با شرط بخشیده باشد،ولی نمی داند که آیا با هر دفعه بخشیدن شرط را نیز ذکر کرده است یا نه، در این صورت می تواند مهریه ی خود را مطالبه نماید؟,احکام و فقه
122370,مردی همسرش را طلاق داده و در مقابل مهریه حق حضانت را به همسرش داده ولی همسرش ازدواج کرده. آیا مرد می تواند دخترش را که الان 7 سال دارد از همسر اولش بگیرد؟,احکام و فقه
122371,چنانچه در عقد موقّت شرط عدم دخول شده باشد، اما بعدا دخول صورت بگیرد یا به نحو دیگری پرده ی بکارت از بین برود، مهریه به چه صورت خواهد بود؟,احکام و فقه
122372,آیا مقتضاى عقد نکاح، وجوب تقابض مهریّه و بضع است، یا واجب است نخست مهریّه تسلیم گردد؟,احکام و فقه
122373,اگر در صیغه محرمیّت ، مهریه معین بشود ولی داماد اشتباها چیز دیگری شنیده باشد بعدا متوجه شود آیا صیغه باطل است؟,احکام و فقه
122374,اگر زوج در هنگام ازدواج جهیزیّه زوجه را از مال خودش تهیّه نماید. آیا در موقع طلاق زوجه حقّ مطالبه و استرداد چنین جهیزیّه اى را دارد یا نمی تواند مطالبه نماید؟,احکام و فقه
122375,چنانچه زوجین در مقدار و اوصاف مهریه اختلاف نمایند، حکم چیست؟,احکام و فقه
122376,آیا امکان این هست که بعد از جاری کردن عقد ازدواج دائم مهریه را تغییر داد یعنی به گونه ای که مثلا اگر مهریه 300 سکه باشد بعد از جاری کردن عقد بخواهند صد سکه و یک واحد آپارتمان باشد؟آیا باید از طریق عقد خارج لازم انجام بگیرد یا اینکه به مصالحه هم مساله مشروعیت پیدا می کند؟,احکام و فقه
122377,اگر زن مهریّه خود را به مردش ببخشد و بگوید: «به شرط آن که تا وقتى که من زنده هستم زن دوّمى نگیری، در این صورت: الف) آیا این شرط از نظر شرعى صحیح است؟ ب) اگر مرد خلاف شرط عمل کند، زن اوّل و زن دوّم نسبت به مرد چه حکمى پیدا مى کنند؟,احکام و فقه
122379,اگر زوج از پرداخت مهریه عاجز باشد، می¬توان او را به زندان انداخت؟,احکام و فقه
122380,آیا مهریه حتماً باید به صورت عند المطالبه در عقدنامه ها ثبت شود؟,احکام و فقه
122381,اگر مهریّه مبلغی پول و نصف مایملک داماد باشد، آیا این مهریه صحیح است؟,احکام و فقه
122382,چون درهم سکه دار در این زمان وجود ندارد، آیا مبناى قیمت مهرالسّنه نرخ نقره عمومى مى باشد؟,احکام و فقه
122383,در عقد موقت در صورتى که دخول صورت نگیرد حداقل مقدار مهریه براى یک هفته چه میزان مناسب است که عقد صحیح باشد؟,احکام و فقه
122384,اگر در هنگام اجرای عقد دائم مثلاً یکصد سکه را به عنوان مهریه ذکر کنند ولی در سند ازدواج پنجاه سکه نوشته بشود : لطفا با توجه به مورد ذکر شده به سؤالات زیر پاسخ بدهید: الف: آیا چنین کاری توسط عاقد صحیح است؟ ب: معیار کدام یک از موارد مهریه می باشد و مرد باید پرداخت نماید؟ ج: آیا قصد جدی مربوط به عاقد است یا طرفین؟,احکام و فقه
122385,با توجه به اینکه یکی از ارکان عقد موقّت تعیین مهر می باشد آیا این مهر حتما باید نقدی باشد یا می تواند غیر نقدی باشد؟ مانند یک شاخه گل.,احکام و فقه
122386,آیا شأن و موقعیّت کارى، اجتماعى، مالى و قدرت بالقوّه انسانها در تعیین مهریّه دخالت دارد؟ (مثلا اگر یک فرد کارگر مهریّه همسرش را 10 کیلو طلا قرار دهد),احکام و فقه
122388,آیا می توان مهریه را با حق طلاق به گونه ای که هرگز مهر و مهر المثل قابل اجرا نباشد، معاوضه کرد؟,احکام و فقه
122391,فقهاى شیعه اکثرا فرموده اند زوجه حق دارد مهر غیر مؤجّل را مطالبه و قبل از دخول مى تواند از تمکین تا گرفتن مهر امتناع نماید، آیا در این مدت نفقه به زن تعلق می گیرد؟,احکام و فقه
122392,مردی در سند ازدواج در سال 70 مهریه همسرش را 300 سکه بهار آزادی قرار داده آن زمان ازرش سکه بسیار پایین بوده در حال حاضر ارزش سکه چند میلیون تومان شده و زن آن را مطالبه کرده است . با توجه به اینکه ارزش عرفی سکه در آن زمان مثلا مبلغ 200 هرار تومان بوده و مهریه در عقد بر مبنای همین مبنا توافق شده آیا امکان دارد بتوان مهریه را تعدیل کرد ؟ متاسفانه همین مسئله باعث مشکلات فراوان برای خانواده ها شده است.,احکام و فقه
122398,"۱. آیا کسی که کاشت ناخن برایش ضرورت ندارد و به دلیل عدم امکان یا ضرر یا مشقت زیاد، هنگام وضو یا غسل، ناخن مصنوعی را برنخواهد داشت، جایز است اقدام به کاشت ناخن کند؟
۲. کسی که بدون ضرورت ناخن مصنوعی کاشته...",احکام و فقه
122399,اگر در وضو، تنها دست را تر کنیم و به صورت و دستها بکشیم (بدون ریختن آب)، کفایت می کند؟,احکام و فقه
122400,مادر بزرگم برای انجام فریضه حج ثبت نام کرد ولی بیمار شد و نتوانست مشرف شود و مادرم به نیابت از ایشان به حج مشرف شد، آیا وجوب حج از مادرم برداشته شده است یا همچنان حج بر مادرم واجب است؟,احکام و فقه
122402,اگر فردی از درآمد بین سال کالایی تهیه کند و سپس به صورت نسیه به فروش برساند نسبت به خمس درآمد مزبور چه تکلیفی دارد؟ آیا جزء درآمد سال وصول محسوب می شود یا سال معامله؟,احکام و فقه
122403,چنانچه دریچه تخلیه آب حوضچه های پرورش ماهی را به نیت صید ماهی باز کرده تا آب کاملا تخلیه شده و ماهی ها جان دهند، آیا عمل مذکور صید محسوب شده و ماهی ها حلال هستند؟,احکام و فقه
122404,اگرهنگام تشهد آخر امام جماعت رکعت اول یا سوم ماموم باشد، آیا تجافی واجب است؟ در حال تجافی چه ذکری باید بگوییم؟,احکام و فقه
122405,آیا هنگام قرائت سوره حمد در نماز باید قواعد تجوید رعایت شود؟,احکام و فقه
122410,آیا طبق معیارهای دینی، عزاداری بدعت محسوب می شود؟!,احکام و فقه
122552,شخصی برای اجارۀ خانه خود، مبلغی وجه نقد به‌عنوان قرض‌الحسنه و مبلغی هم ماهیانه مال الاجاره از مستأجر دریافت می‌کند. سکونت و خواندن نماز در این خانه چه حکمی دارد؟,احکام و فقه
122553,آیا انسان می‌تواند در بیابان، باغ یا مزرعه‌ای که حصار ندارد، نماز بخواند یا از آب تلمبه‌ای که در آن مزرعه وجود دارد وضو بگیرد؟,احکام و فقه
122554,آیا اگر در یک اتاق، هم‌زمان یک مرد و یک زن نماز بخوانند و زن جلوتر بایستد نمازشان اشکال دارد؟ معیار در این مسأله چیست؟ اگر زن محرم باشد چطور؟,احکام و فقه
122555,استفاده از بلندگوهای مسجد جهت (اجرای مراسم عزاداری و غیره) درصورتی‌که باعث نارضایتی همسایگان شود، چه حکمی دارد؟,احکام و فقه
122557,پولی متعلق به مسجد می‌باشد آیا می‌توان آن را در بانک سپرده‌گذاری کرد یا در جای دیگری سرمایه‌گذاری نمود؟ در‌آمد حاصل از سود آن پول‌ها چه حکمی دارد؟ با توجّه به این‌که اهدا کنندگان قدیمی‌ مسجد می‌گویند این...,احکام و فقه
122558,نماز خواندن در خانۀ کسانی که طبق آیۀ شریفه قرآن کریم در آن‌جا جواز خوردن داریم، بدون احراز رضایت آن‌ها چگونه است؟,احکام و فقه
122559,مدرسه‌ای است که ملک آن موقوفه است و وزارت‌ آموزش و پرورش آن را از سازمان اوقاف اجاره کرده است. نماز خواندن معلمان و مدیران در آن مدرسه چه حکمی دارد؟,احکام و فقه
122560,اگر شخصی به خاطر فقر در قطعه زمینی که صاحب آن معلوم نیست تصرّف نماید و در آن خانه‌ای بنا کند سکونت و نماز در آن خانه چه حکمی دارد؟,احکام و فقه
122561,کسی که نماز خوابیده می‌خواند و ملحفه روی اوست، درصورتی‌که ملحفه نجس باشد وظیفه‌اش چیست؟,احکام و فقه
122562,بیمار دیالیزی هستم و گاهی پیش می‌آید که اول وقت نماز در حال دیالیز هستم و اگر تا منزل بروم و تطهیر کنم ممکن است نمازم قضا شود. آیا می‌توانم در حال دیالیز نماز بخوانم؟,احکام و فقه
122563,اگر نمازگزار در بین نماز خون‌دماغ شود، تکلیف چیست؟,احکام و فقه
122564,فرد مسلوس که ادرارش قطع نمی‌شود، برای نماز چه وظیفه‌ای دارد؟,احکام و فقه
122565,شخصی نزدیک صبح جنب شده و زمانی از خواب بیدار می‌شود که وقت غسل و تطهیر ندارد لذا تیمّم بدل از غسل می‌کند تا نماز را بجا آورد. آیا می‌تواند در همان حال و با همان لباس نماز را بجا آورد؟,احکام و فقه
122566,گاهی در مأموریت‌های امدادی چند نفر از یک لباس استفاده می‌کنند؛ حکم طهارت لباس مذکور، جهت اقامۀ نماز چگونه است؟,احکام و فقه
122567,اگر لباس امدادگر در مأموریت، آلوده به نجاست گردد و فقط همان یک دست لباس را داشته باشد، نماز خواندن با آن لباس چه حکمی دارد؟,احکام و فقه
122568,کسی که خونریزی بواسیر و یا زخم بواسیر دارد و محل زخم، همیشه آلوده به خون است، حکم نمازش چیست؟ آیا می‌تواند در نماز جماعت شرکت کند؟,احکام و فقه
122569,نماز در دو لباسی که یقین دارد در یکی از آن‌ها نماز باطل خواهد بود، چگونه است؟,احکام و فقه
122570,اگر شخصی در نجاست یکی از دو لباسش مردد باشد چگونه باید نماز بخواند؟,احکام و فقه
122572,آیا پوشیدن لباس مخصوص کفّار مانند لباس مخصوص هندوها یا لباس‌های محرّک شهوت جایز است؟ نماز با آن چه حکمی دارد؟,احکام و فقه
9805,آيا در ازدواج موقت نيز مادر زن بر داماد حرمت دايمى پيدا مى‌کند؟,اخلاق اسلامی
9470,آيا زن مى‌تواند در منزل وظايف خود را انجام ندهد، مثلاً غذا نپزد، خانه را مرتّب  نکند؟ آيا مرد مى‌تواند زن را مجبور به انجام اين‌گونه امور نمايد؟,اخلاق اسلامی
9476,با توجّه به نصّ قرآن کريم مبنى بر احسان نسبت به والدين، در صورت عدم رضايت و اذن شوهر، آيا زن مى‌تواند بدون توجّه به اذن شوهر، براى رسيدگى به پدر و مادر از منزل خارج شود؟,اخلاق اسلامی
9483,آيا کمک مالى شوهر به خانواده‌ى خويش ـ با توجه به درآمد کم خود ـ درست است؟,اخلاق اسلامی
9484,آيا زن در انتخاب پوشش، بايد مطيع همسر خود باشد؟,اخلاق اسلامی
9495,اگر شوهر از زن بخواهد که در مجالس عروسى و ميهمانى شرکت کند، وظيفه‌ى او چيست؟,اخلاق اسلامی
9496,خانم من حقوقش را پس‌انداز مى‌کند يا به پدر و مادرش مى‌دهد و در خانه خرج نمى‌کند، آيا چنين حقى دارد؟,اخلاق اسلامی
9498,آيا من درآمدم را به شوهر بدهم يا اين که آن‌ها را پس انداز نمايم و در موارد ضرورى به او کمک کنم؟,اخلاق اسلامی
9517,نزديکى و همخوابى با همسر چه تفاوتى دارد؟,اخلاق اسلامی
9520,آيا مرد مى‌تواند شير همسر شرعى خود را بخورد؟,اخلاق اسلامی
