_id,content,category
124498,خانمى چون نمى‌دانسته باید خود را وارسى کند، شک دارد که به مقدار سه روز خون دیده یا خیر، حال وظیفه‌اش چیست؟,عرفان و معنویت
124127,بهترین تعقیب مشترک بین تمام نمازها چیست؟,عرفان و معنویت
124544,برای مضطربه شدن، چند بار باید خلاف عادت خود خون ببیند؟,عرفان و معنویت
124571,کسی که براثر زخم نمی‌تواند خود را وارسی کند وظیفه‌اش چیست؟ با احتمال پاک شدن، غسل کند یا صبر کند تا یقین کند پاک شده است؟,عرفان و معنویت
123983,با توجه به جایگاه حج در قرآن کریم، فلسفه تکبیرات در منا چیست‌؟,عرفان و معنویت
124011,آیا برای مسّ آن‌چه مانند (ا...) و (ال...) عرفاً رمز برای اسم جلاله است، طهارت لازم است؟,عرفان و معنویت
123451,نماز زیارت امام‌زادگان، به چه نیتی خوانده می‌شود؟,عرفان و معنویت
123912,راه‌های ایجاد حضور قلب در نماز را بیان فرمایید.,عرفان و معنویت
123094,با چند بار شک، کثیر الشک محقّق می‌شود؟,عرفان و معنویت
123106,فرق بین کثیر الشک و وسواسی چیست؟,عرفان و معنویت
125138,آیا آب دریا، آب جاری به‌حساب می‌آید؟,عرفان و معنویت
124889,میز چوبی نجس را چگونه می‌توان تطهیر کرد؟,عرفان و معنویت
125100,آیا آبی که بر اثر دیدن منظرۀ شهوت‌انگیز خارج مى شود پاک است؟,عرفان و معنویت
125077,در ایّام عاشورای حضرت سید الشهدا علیه‌السلام از تربت شریف یا از شاخه‌ها و برگ‌های بعضی از درختان خون جاری می‌شود. آیا این خون نیز حکم خون‌های دیگر را دارد؟,عرفان و معنویت
126481,دختری ۲۱ ساله هستم ۱۰ ماه است که ازدواج کردم. حدود ۴ ماه قبل از ازدواجم به طور مداوم پسری را در راه دانشکده ام میدیدم که کم کم فهمیدم انگار عاشقش شده ام. ما هیچ گونه ارتباطی با هم نداشته ام فقط ارتباط چشمی... با وجود این، هنگام ازدواجم سعی کردم او را نادیده گرفته و یک تصمیم عاقلانه بگیرم. الان با همسرم هیچگونه مشکلی ندارم ولی به هیچ وجه نمیتوانم او را فراموش کنم طوری که هر وقت او را میبینم تا مدتی از ذهنم بیرون نرفته و بیشتر اوقات گریه میکنم. حالا باید چیکار کنم که این عشق باعث سردی زندگی زناشوئیم نشود؟,عرفان و معنویت
126483,**از نظر شما، چه عواملی فراتر از جنبه‌های مادی و ظاهری زندگی می‌توانند در سعادت و آرامش فرد نقش داشته باشند؟**,عرفان و معنویت
126207,انزوا طلبی و عزلتی که در آیات و روایات به آن سفارش شده و بر آن تأکید شده، به چه معناست؟,عرفان و معنویت
126208,انزوا طلبی چه آثار و پیامدهایی دارد؟,عرفان و معنویت
126210,کارهای خاص و عجیب و غریبی در خانه اتفاق می افتد و تصورم بر این است که مربوط به جنیان است. چه توصیه ای در این زمینه دارید؟,عرفان و معنویت
126224,شیوه‌‏های ایجاد و تقویت اعتماد به نفس از نظر اسلام چیست؟,عرفان و معنویت
126225,علت اینکه فرد توانایی های خود را دست کم یا نادیده می گیرد چیست؟,عرفان و معنویت
126226,ما باید چه کارهایی انجام دهیم تا اضطراب اجتماعی را کاهش دهیم و در جمع راحت‌تر باشیم؟,عرفان و معنویت
126230,راه های تقویت اراده چیست؟,عرفان و معنویت
126232,چگونه می توان اراده قوی و اعتماد به نفس در حضور جمع را کسب کرد؟,عرفان و معنویت
159073,چرا حضرت یعقوب علیه السلام در هنگام حرکت فرزندانش به مصر به آنها گفت که از درهاى مختلف وارد مصر شوند؟,تاریخ اسلام و شخصیت ها
159075,ماجراى غدیر چگونه بود؟,تاریخ اسلام و شخصیت ها
159076,امام حسین(علیه السلام) در سال آخر حکومت معاویه خطاب به حجاج حاضر در منی چه فرمودند؟,تاریخ اسلام و شخصیت ها
159077,آیا امیرالمؤمنین (علیه السلام) و اهل بیت ایشان با حدیث غدیر بر خلافت خویش استدلال کرد؟ همه می دانیم پیامبر گرامی اسلام (صلّی الله علیه و آله و سلم) خلافت و جانشینی بلافصل امیر المؤمنین (علیه السلام) را در روز غدیر اعلام نمود و اطاعت و پیروی از او را بر همه مسلمانان واجب ساخت، در اینجا این سؤال پیش می آید: هر گاه جانشینی امیر المؤمنین در چنین روزی اعلام گردیده، پس چرا امام در طول حیات خود با این حدیث برای اثبات امامت خویش استدلال نکرده است؟,تاریخ اسلام و شخصیت ها
159078,در غدیر چه گذشت؟,تاریخ اسلام و شخصیت ها
159080,آیا صحابه بر واقعه غدیر گواهى داده اند؟,تاریخ اسلام و شخصیت ها
159081,چگونه ممکن است در روز غدیر هزاران نفر با على(علیه السلام) بیعت کنند سپس همه آنها در جریان سقیفه بر علیه او توطئه کنند؟,تاریخ اسلام و شخصیت ها
159082,بیان امیرالمؤمنین(علیه السلام) از معناى «مولى» در حدیث غدیر چیست؟,تاریخ اسلام و شخصیت ها
159083,تفسیر پیامبر(صلى الله علیه وآله) از معناى مولى در حدیث غدیر چیست؟,تاریخ اسلام و شخصیت ها
159085,از صحابه پیامبر(صلى الله علیه وآله) چه کسانی حدیث غدیر را نقل کرده اند؟,تاریخ اسلام و شخصیت ها
159086,صاحب بن عبّاد از واژه مولى چه معنائى را فهمیده است؟,تاریخ اسلام و شخصیت ها
159088,احتجاج حسن بن على(علیهما السلام) به حدیث غدیر در کجا و چگونه بوده است؟,تاریخ اسلام و شخصیت ها
159089,استدلال عمروعاص به حدیث غدیر علیه معاویه چگونه بوده است؟,تاریخ اسلام و شخصیت ها
159090,آیا فاطمه زهراء(علیها السلام) به حدیث غدیر احتجاج نموده است؟,تاریخ اسلام و شخصیت ها
159092,ارتباط آیه تبلیغ با واقعه غدیر چیست؟,تاریخ اسلام و شخصیت ها
159093,عمار چگونه به حدیث غدیر علیه عمرو عاص استدلال نموده است؟,تاریخ اسلام و شخصیت ها
159094,آیا غدیر از اعیاد اسلامى است یا اختصاص به شیعیان دارد؟,تاریخ اسلام و شخصیت ها
159095,آیا در واقعه غدیر خم ابوبکر و عمر به امیر مؤمنان(علیه السلام) تبریک گفته اند؟,تاریخ اسلام و شخصیت ها
159096,نحوه بیعت و تبریک گوئى مردم به أمیرالمؤمنین(علیه السلام) در روز غدیر چگونه بود؟,تاریخ اسلام و شخصیت ها
159099,آیا عید غدیر ساخته و پرداخته شیعه است؟,تاریخ اسلام و شخصیت ها
159100,اولین کسی که به سند حدیث غدیر اشکال وارد کرد که بود و چه کسانی به آن دامن زدند؟,تاریخ اسلام و شخصیت ها
159151,در منابع اهل سنت چه روایاتی از پیامبر اکرم (صلّی الله علیه وآله) دربارۀ چگونگی انعقاد نطفۀ حضرت فاطمه (علیها السلام) نقل شده است؟,تاریخ اسلام و شخصیت ها
159153,آیا ابوبکر از بی حرمتی به خانه وحی ابراز ندامت کرد؟,تاریخ اسلام و شخصیت ها
159154,آیا استدلال به غیرت عرب نسبت به زنان برای انکار حمله به حضرت فاطمه زهرا (علیها السلام) صحیح است؟,تاریخ اسلام و شخصیت ها
159155,آیا یورش عمر به خانه امام علی و حضرت فاطمه (علیهما السلام) حقیقت ندارد؟,تاریخ اسلام و شخصیت ها
159156,در منابع اهل سنت چه کنیه ای برای حضرت زهرا (علیها السلام) نقل شده است؟,تاریخ اسلام و شخصیت ها
159157,ماجرای سخن گفتن حضرت فاطمه زهرا (سلا م الله علیها) با مادرشان پیش از تولد چه بوده است؟,تاریخ اسلام و شخصیت ها
159158,تنها دستی که پیامبر اکرم (صلی الله علیه و آله) آن را بوسید، دست چه کسی بود؟,تاریخ اسلام و شخصیت ها
159160,آیا در کتب لغت به فدک و خطبه فدکیه حضرت فاطمه زهرا (علیها السلام) اشاره شده است؟,تاریخ اسلام و شخصیت ها
159161,چرا حضرت فاطمه زهرا (سلام الله علیها) بتول نامیده شدند؟,تاریخ اسلام و شخصیت ها
159163,استاد عباس محمود عقٌاد مصری درباره شخصیت حضرت فاطمه (سلام الله علیها) چه می گوید؟,تاریخ اسلام و شخصیت ها
159164,عبد الحمید ابن ابی الحدید درباره شخصیت حضرت فاطمه (سلام الله علیها) چه می گوید؟,تاریخ اسلام و شخصیت ها
159165,محمدبن طلحه شافعی درباره شخصیت حضرت فاطمه (سلام الله علیها) چه می گوید؟,تاریخ اسلام و شخصیت ها
159166,ابن صباغ مالکی درباره شخصیت حضرت فاطمه (سلام الله علیها) چه می گوید؟,تاریخ اسلام و شخصیت ها
159168,حافظ ابو نعیم اصفهانی درباره شخصیت حضرت فاطمه (سلام الله علیها) چه می گوید؟,تاریخ اسلام و شخصیت ها
159169,علامه اربلی درباره شخصیت حضرت فاطمه (سلام الله علیها) چه می گوید؟,تاریخ اسلام و شخصیت ها
159170,شهاب الدین آلوسی درباره امام علی علیه السلام و حضرت فاطمه علیها السلام و فرزندانشان علیهم السلام چه دیدگاهی دارد؟,تاریخ اسلام و شخصیت ها
159172,علامه ابن شهر آشوب درباره شخصیت حضرت فاطمه زهرا (سلام الله علیها) چه می گوید؟,تاریخ اسلام و شخصیت ها
159173,امام باقر (علیه السلام) خانه امام علی و حضرت فاطمه (سلام الله علیهما) را چگونه توصیف می کند؟,تاریخ اسلام و شخصیت ها
159174,استاد توفیق ابوعلم دربارۀ خطبه فدکیه چه می گوید؟,تاریخ اسلام و شخصیت ها
159177,آیا اعتراض ابن تیمیه به حزن و اندوه حضرت زهرا (علیها السلام) بعد از پیامبر (صلی الله علیه وآله) مورد قبول است؟,تاریخ اسلام و شخصیت ها
159179,حضرت زهرا (علیها السلام) نزد پیامبر (صلى الله علیه وآله) از چه جایگاه و منزلتى بر خوردار بودند؟,تاریخ اسلام و شخصیت ها
159180,امام علی (علیه السلام) در کنار قبر حضرت فاطمه (علیها السلام) چگونه با پیامبر (صلی الله علیه و آله) درد دل کردند؟,تاریخ اسلام و شخصیت ها
159181,آیا اعتراض ابن تیمیه به قهر کردن حضرت زهرا (علیها السلام) با ابوبکر صحیح است؟,تاریخ اسلام و شخصیت ها
159182,بر اساس منطق قرآنی استدلال ابوبکر در غصب فدک چه اعتباری دارد؟,تاریخ اسلام و شخصیت ها
159183,احترام خانه حضرت زهرا (علیها السلام) در قرآن و سنت چگونه بیان شده است؟,تاریخ اسلام و شخصیت ها
159184,«نظّام» از علمای اهل سنت، ماجرای یورش به خانه حضرت زهرا(علیها السلام) را چگونه بیان می کند؟,تاریخ اسلام و شخصیت ها
159185,آیا درست است که حضرت علی (ع) از دختر ابوجهل خواستگاری کردند و رسول خدا (ص) به همین مناسبت فرمود: «فاطمه پاره تن من است، هر کسی او را بیازارد، مرا آزرده است»؟!,تاریخ اسلام و شخصیت ها
159186,در زمان حضرت زهراء (س) در مدینه درب چوبی وجود نداشت که آتش زده شود! شیعیان چگونه ادّعا می کنند که عمر بن خطاب در خانه علی بن ابی طالب(ع) را آتش زده است؟!,تاریخ اسلام و شخصیت ها
159190,«عبدالفتاح عبدالمقصود» عالم اهل سنت، ماجرای یورش به خانه حضرت زهرا(علیها السلام) و جسارت به ایشان را چگونه شرح می دهد؟,تاریخ اسلام و شخصیت ها
159191,چرا دستگاه خلافت، «فدک» را از حضرت فاطمه (سلام الله علیها) گرفت؟,تاریخ اسلام و شخصیت ها
159193,چه اقوالی درباره محل دفن حضرت زهرا(سلام الله علیها) وجود دارد؟,تاریخ اسلام و شخصیت ها
159195,«مؤید فى الدین» چه سروده اى در رابطه با غدیر خم دارد؟,تاریخ اسلام و شخصیت ها
159196,آیا حدیث غدیر دلالت بر خلافت بلافصل حضرت على علیه السلام مى نماید؟,تاریخ اسلام و شخصیت ها
159197,مناقشات فخر رازى پیرامون معناى واژه مولا در حدیث غدیر چیست؟,تاریخ اسلام و شخصیت ها
159199,آیا پیامبر(صلی الله علیه و آله) در حدیث غدیر از واژه مولا معناى محب و ناصر را اراده فرموده است؟,تاریخ اسلام و شخصیت ها
159101,چه کسی روز غدیر را روز عید قرار داده است؟,تاریخ اسلام و شخصیت ها
159102,به چه جهت پیامبر(صلى الله علیه وآله) در روز غدیر خم عمامۀ خویش را بر سر على(علیه السلام) بستند؟,تاریخ اسلام و شخصیت ها
159103,از بزرگان و سرشناسان اهل سنت چه کسانى قائل به صحت و تواتر حدیث غدیر می باشند؟,تاریخ اسلام و شخصیت ها
159106,جریان رحلت حضرت فاطمه (علیها السلام) در منابع اهل سنت چگونه نقل شده است؟,تاریخ اسلام و شخصیت ها
159112,چه روایاتی درباره ی مهرورزی و غم‌خواری فاطمه (علیها السلام) نسبت به پیامبر اکرم (صلی الله علیه و آله) در منابع اهل سنت وارد شده است؟,تاریخ اسلام و شخصیت ها
159113,چه دعاهایی از پیامبر اکرم (صلّی الله علیه و آله) در وقت ازدواج حضرت فاطمه زهرا (علیها السلام) با امام علی (علیه السلام) نقل شده است؟,تاریخ اسلام و شخصیت ها
159114,چه روایاتی درباره نتیجه دوستی و محبت به حضرت فاطمه (علیها السلام)، از پیامبر اکرم (صلی الله علیه و آله) نقل شده است؟,تاریخ اسلام و شخصیت ها
159115,علمای اهل سنت دربارۀ مصائب حضرت فاطمه زهرا (علیها السلام) چه روایاتی نقل کرده اند؟,تاریخ اسلام و شخصیت ها
159116,چرا ابوبکر تقاضای حضرت فاطمه زهرا (علیهاالسلام) درباره عودت فدک را نپذیرفت؟,تاریخ اسلام و شخصیت ها
159117,انگیزه ابو بکر از غصب فدک چه بود؟,تاریخ اسلام و شخصیت ها
159120,در منابع اهل سنت چه روایاتی دربارۀ اینکه فرزندان حضرت فاطمه (علیها السلام)، فرزندان رسول خدا (صلی الله علیه وآ له) هستند آمده است؟,تاریخ اسلام و شخصیت ها
159121,حضرت فاطمه زهرا (سلام الله علیها) در مورد عملی نشدن وصایای پیامبر اکرم (صلی الله علیه و آله) توسط اصحاب چه گفتاری دارند؟,تاریخ اسلام و شخصیت ها
159122,فضایل حضرت فاطمه زهرا (سلام الله علیها) در کلام ائمه معصومین (علیهم السلام) چگونه است؟,تاریخ اسلام و شخصیت ها
159123,آیا آنچه بیهقی در مورد راضی شدن حضرت فاطمه (علیها السلام) از شیخین نقل کرده اعتباری دارد؟,تاریخ اسلام و شخصیت ها
159124,آیا حضرت زهرا (علیها السلام) در برابر انحراف جامعه مسلمین بعد از رحلت رسول خدا (صلی الله علیه و آله) سکوت کردند؟,تاریخ اسلام و شخصیت ها
159125,چه فضائلی درباره ی حضرت فاطمه زهرا (علیها السلام) از زبان پیامبر اکرم (صلى الله علیه و آله) در کتب اهل سنت نقل شده است؟,تاریخ اسلام و شخصیت ها
159126,رسول خدا (صلی الله علیه و آله) درباره جایگاه حضرت زهرا (علیها السلام) نسبت به علی(علیه السلام) چه می فرماید؟,تاریخ اسلام و شخصیت ها
159127,چه روایاتی در منابع اهل سنت از زبان عایشه درباره ی شباهت حضرت فاطمه (علیها السلام) به پیامبر اکرم (صلی الله علیه وآله) نقل شده است؟,تاریخ اسلام و شخصیت ها
159128,در منابع اهل سنت چه روایاتی از پیامبر اکرم (صلی الله علیه وآله) مبنی بر پاکیزگی حضرت فاطمه زهرا (علیها السلام) از عادات زنانه نقل شده است؟,تاریخ اسلام و شخصیت ها
159131,تاریخ نویسان اهل سنت درباره احوال حضرت فاطمه (علیها السلام) در رحم مادر چه روایاتی را نقل کرده اند؟,تاریخ اسلام و شخصیت ها
159132,آیا همانطور که عایشه می گوید پیامبر اکرم (ص) بعد از خود ارثی بجای نگذاشته است؟,تاریخ اسلام و شخصیت ها
159133,آیا حضرت فاطمه زهرا (علیها السلام) عذر خواهی ابوبکر و عمر را پذیرفت؟,تاریخ اسلام و شخصیت ها
159134,آیا حضرت فاطمه زهرا (سلام الله علیها) از اقدامات ابوبکر ناراضی و خشمگین بود؟,تاریخ اسلام و شخصیت ها
159135,آیا عثمان حق بخشیدن فدک را به مروان داشت؟,تاریخ اسلام و شخصیت ها
159136,چه فضائلی از زبان عایشه برای حضرت فاطمه زهرا (علیها السلام) نقل شده است؟,تاریخ اسلام و شخصیت ها
159137,در منابع اهل سنت چه روایتی دربارۀ نزول غذای بهشتی برای فاطمه (علیها السلام) نقل شده است؟,تاریخ اسلام و شخصیت ها
159138,دربارۀ اینکه حضرت فاطمه (علیها السلام) محبوب ترین مردم نزد پیامبر اکرم (صلی الله علیه وآله) بود چه روایاتی از اهل سنت نقل شده است؟,تاریخ اسلام و شخصیت ها
159140,چرا دختر رسول خدا (صلی الله علیه وآله) «فاطمه» نامیده شد؟,تاریخ اسلام و شخصیت ها
159144,در منابع اهل سنت چه روایاتی از پیامبر اکرم (صلی الله علیه وآله) دربارۀ ثمرۀ پاکدامنی حضرت فاطمه (علیها السلام) نقل شده است؟,تاریخ اسلام و شخصیت ها
159145,علمای اهل سنت چه گفتاری درباره شخصیت حضرت فاطمه زهرا (علیها السلام) دارند؟,تاریخ اسلام و شخصیت ها
159146,در منابع اهل سنت چه فضائلى درباره حضرت زهرا (علیها السلام) نقل شده است؟,تاریخ اسلام و شخصیت ها
159149,حضرت فاطمه زهرا (علیها السلام) چگونه بر رحلت پیامبر اکرم (صلّی الله علیه وآله) مرثیه سرایی کرد؟,تاریخ اسلام و شخصیت ها
159200,«ابو الحسن فَنْجُکِردى» چه سروده اى در رابطه با غدیر خم دارد؟,تاریخ اسلام و شخصیت ها
159201,کلمه مولى چند معنى دارد و در حدیث غدیر کدام یک از آنها مى تواند مراد باشد؟,تاریخ اسلام و شخصیت ها
159202,ابن منیر طرابلسى چه سروده اى در رابطه با على(علیه السلام) دارد؟,تاریخ اسلام و شخصیت ها
159203,قاضى ابن قادوس چه سروده اى در رابطه با فضائل امیرالمؤمنین(علیه السلام) دارد؟,تاریخ اسلام و شخصیت ها
159204,«جبرى مصرى» چه سروده اى در رابطه با غدیر خم دارد؟,تاریخ اسلام و شخصیت ها
159205,ابن عودى نیلى چه سروده اى در رابطه با غدیر خم دارد؟,تاریخ اسلام و شخصیت ها
159206,عمرو عاص در مدح على(علیه السلام) و مذمت معاویه چه قصیده ای دارد؟,تاریخ اسلام و شخصیت ها
159207,«قاضى جلیس» چه سروده اى در رابطه با غدیر خم دارد؟,تاریخ اسلام و شخصیت ها
159209,خطیب خوارزمى چه سروده اى در رابطه با غدیر خم دارد؟,تاریخ اسلام و شخصیت ها
159210,امیرالمؤمنین علی(علیه السلام) در بارۀ حدیث غدیر چه سروده ای دارند؟,تاریخ اسلام و شخصیت ها
159211,حسان بن ثابت در مورد غدیر خم چه سروده ای دارد؟,تاریخ اسلام و شخصیت ها
159212,«ملک صالح» چه سروده اى در رابطه با غدیر خم دارد؟,تاریخ اسلام و شخصیت ها
13974,در حال حاضر اکثر گوشی ها نرم افزار قرآن دارند، آیا لیالی قدر میشود یک صفحه قرآن را ازگوشی باز کرد و آنرا که داخل موبایل هست روی سر گذاشت؟,منابع دینی
14231,در بعضی از کتاب های دعا در قسمت زیارت عاشورا کلماتشان کم یا زیاد هست کدام‌یک از آن‌ها درست هست؟,منابع دینی
14243,در سطح اینترنت ذکر بسم الله الرحمن الرحیم بحق بسم الله الرحمن الرحیم بسیار منتشر شده است ولی هیچ جا منبع آن نوشته نشده آیا این ذکر معتبر هست؟,منابع دینی
14246,دعاي چهل کليد که ازحضرت فاطمه زهرا سلام الله تعالی نقل شده چيست وچه خاصيتي دارد؟,منابع دینی
14249,آیا دعای حل مشکلات از کتب معصومین رسیده است؟,منابع دینی
14191,آیا آیه ی 30 سوره ی الذاریات که گفته قالوا کذالک قال ربک (در اینجا ک پایانی کذالک با کسره و ک ربک با کسره می باشد) از همین اشتباهات نگارشی قرآن عثمان طه هست یا آنکه قاعده ی مخصوص به خود دارد؟ مثلا برای مونث با کسره میاید ک پایانی کذالک و ربک ؟,منابع دینی
